{
  "event_chain_hash": "990016d9cd68e4ea6a9dffd793c3d487032f81e034d7126bb90f6033f8c5c122",
  "rng_state_digest": "2ffec463b920a7bb41d1aeba9826d33977de1cf882f6911f5c923c3d0fe326a6",
  "state": {
    "constants": {
      "day_ticks": 1440,
      "dt_ms": 100,
      "max_entities": 512,
      "snapshot_every_ticks": 50,
      "tick_rate_hz": 10,
      "world_bounds_mm": {
        "x": 60000,
        "y": 30000,
        "z": 24000
      }
    },
    "entities": [
      {
        "id": "bench-01",
        "kind": "prop",
        "tags": [
          "interactive",
          "rest"
        ],
        "transform": {
          "nav_node_id": "nav-bench",
          "pos_mm": {
            "x": 33000,
            "y": 0,
            "z": 12000
          },
          "room_id": null,
          "rot_mdeg": {
            "x": 0,
            "y": 90000,
            "z": 0
          }
        }
      },
      {
        "id": "courtyard-01",
        "kind": "zone",
        "tags": [
          "outdoor",
          "shared"
        ],
        "transform": {
          "nav_node_id": "nav-courtyard",
          "pos_mm": {
            "x": 30000,
            "y": 0,
            "z": 12000
          },
          "room_id": null,
          "rot_mdeg": {
            "x": 0,
            "y": 0,
            "z": 0
          }
        }
      },
      {
        "id": "gate-north",
        "kind": "portal",
        "tags": [
          "inactive-target",
          "portal"
        ],
        "transform": {
          "nav_node_id": "nav-gate-north",
          "pos_mm": {
            "x": 30000,
            "y": 0,
            "z": 24000
          },
          "room_id": null,
          "rot_mdeg": {
            "x": 0,
            "y": 0,
            "z": 0
          }
        }
      },
      {
        "id": "laundry-01",
        "kind": "zone",
        "tags": [
          "chore",
          "shared"
        ],
        "transform": {
          "nav_node_id": "nav-laundry",
          "pos_mm": {
            "x": 18000,
            "y": 0,
            "z": 3000
          },
          "room_id": null,
          "rot_mdeg": {
            "x": 0,
            "y": 0,
            "z": 0
          }
        }
      },
      {
        "emotion": {
          "arousal": 0.28,
          "mood_label": "numb",
          "updated_tick": 0,
          "valence": -0.15
        },
        "id": "npc-001",
        "kind": "npc",
        "memory_ref": {
          "episode_table": "episodes",
          "fact_keys": [],
          "last_reflect_tick": null,
          "working_buffer_id": "wb-npc-001"
        },
        "needs": {
          "belonging": 0.03322900000000433,
          "esteem": 0.05703600000000929,
          "physiology": 0.057194000000007086,
          "safety": 0.05719400000000713,
          "self_actualization": 0.049478000000008834
        },
        "relations": {
          "npc-002": 0.35,
          "npc-003": 0.1,
          "npc-004": 0.05,
          "npc-005": 1.0
        },
        "schedule": {
          "entry_id": "night-shift",
          "state": "resting",
          "target_entity": "room-101",
          "until_tick": 4320
        },
        "tags": [
          "night-shift",
          "resident"
        ],
        "transform": {
          "nav_node_id": "nav-room-101",
          "pos_mm": {
            "x": 6066,
            "y": 0,
            "z": 3000
          },
          "room_id": "room-101",
          "rot_mdeg": {
            "x": 0,
            "y": 0,
            "z": 0
          }
        },
        "trauma_flags": [
          {
            "healed_tick": null,
            "id": "loss-of-spouse",
            "severity": 3,
            "since_tick": 0
          }
        ]
      },
      {
        "emotion": {
          "arousal": 0.45,
          "mood_label": "content",
          "updated_tick": 0,
          "valence": 0.3
        },
        "id": "npc-002",
        "kind": "npc",
        "memory_ref": {
          "episode_table": "episodes",
          "fact_keys": [
            "works-downtown"
          ],
          "last_reflect_tick": null,
          "working_buffer_id": "wb-npc-002"
        },
        "needs": {
          "belonging": 0.05323800000000707,
          "esteem": 0.036795000000004706,
          "physiology": 0.06557700000000923,
          "safety": 0.0655770000000093,
          "self_actualization": 0.040795000000004744
        },
        "relations": {
          "npc-001": 0.35,
          "npc-003": 1.0,
          "npc-004": 1.0,
          "npc-005": 1.0
        },
        "schedule": {
          "entry_id": "commuter",
          "state": "resting",
          "target_entity": "room-102",
          "until_tick": 4320
        },
        "tags": [
          "commuter",
          "resident"
        ],
        "transform": {
          "nav_node_id": "nav-room-102",
          "pos_mm": {
            "x": 12000,
            "y": 0,
            "z": 3000
          },
          "room_id": "room-102",
          "rot_mdeg": {
            "x": 0,
            "y": 0,
            "z": 0
          }
        },
        "trauma_flags": []
      },
      {
        "emotion": {
          "arousal": 0.22,
          "mood_label": "calm",
          "updated_tick": 0,
          "valence": 0.05
        },
        "id": "npc-003",
        "kind": "npc",
        "memory_ref": {
          "episode_table": "episodes",
          "fact_keys": [
            "keeps-daily-routine"
          ],
          "last_reflect_tick": null,
          "working_buffer_id": "wb-npc-003"
        },
        "needs": {
          "belonging": 0.029159000000001472,
          "esteem": 0.05274100000000856,
          "physiology": 0.06045200000000997,
          "safety": 0.060452000000009956,
          "self_actualization": 0.06278700000000853
        },
        "relations": {
          "npc-001": 0.1,
          "npc-002": 1.0,
          "npc-004": 1.0,
          "npc-005": 0.55
        },
        "schedule": {
          "entry_id": "retired",
          "state": "resting",
          "target_entity": "room-102",
          "until_tick": 4320
        },
        "tags": [
          "resident",
          "retired"
        ],
        "transform": {
          "nav_node_id": "nav-courtyard",
          "pos_mm": {
            "x": 12000,
            "y": 0,
            "z": 3000
          },
          "room_id": null,
          "rot_mdeg": {
            "x": 0,
            "y": 180000,
            "z": 0
          }
        },
        "trauma_flags": [
          {
            "healed_tick": null,
            "id": "empty-nest",
            "severity": 2,
            "since_tick": 0
          }
        ]
      },
      {
        "emotion": {
          "arousal": 0.6,
          "mood_label": "anxious",
          "updated_tick": 0,
          "valence": -0.05
        },
        "id": "npc-004",
        "kind": "npc",
        "memory_ref": {
          "episode_table": "episodes",
          "fact_keys": [
            "overloaded-schedule"
          ],
          "last_reflect_tick": null,
          "working_buffer_id": "wb-npc-004"
        },
        "needs": {
          "belonging": 0.041168000000006186,
          "esteem": 0.04580400000000866,
          "physiology": 0.0458750000000057,
          "safety": 0.04587500000000566,
          "self_actualization": 0.06414400000001022
        },
        "relations": {
          "npc-001": 1.0,
          "npc-002": 1.0,
          "npc-003": 1.0,
          "npc-005": 0.75
        },
        "schedule": {
          "entry_id": "caregiver",
          "state": "resting",
          "target_entity": "room-102",
          "until_tick": 4320
        },
        "tags": [
          "caregiver",
          "resident"
        ],
        "transform": {
          "nav_node_id": "nav-laundry",
          "pos_mm": {
            "x": 12000,
            "y": 0,
            "z": 3000
          },
          "room_id": null,
          "rot_mdeg": {
            "x": 0,
            "y": 0,
            "z": 0
          }
        },
        "trauma_flags": [
          {
            "healed_tick": null,
            "id": "caregiver-burnout",
            "severity": 4,
            "since_tick": 0
          }
        ]
      },
      {
        "emotion": {
          "arousal": 0.5,
          "mood_label": "hopeful",
          "updated_tick": 0,
          "valence": 0.2
        },
        "id": "npc-005",
        "kind": "npc",
        "memory_ref": {
          "episode_table": "episodes",
          "fact_keys": [
            "studying-for-exam"
          ],
          "last_reflect_tick": null,
          "working_buffer_id": "wb-npc-005"
        },
        "needs": {
          "belonging": 0.058222000000008683,
          "esteem": 0.051677000000007356,
          "physiology": 0.06346800000000952,
          "safety": 0.0634680000000096,
          "self_actualization": 0.03026700000000418
        },
        "relations": {
          "npc-001": 1.0,
          "npc-003": 0.55,
          "npc-004": 0.2
        },
        "schedule": {
          "entry_id": "student",
          "state": "resting",
          "target_entity": "room-201",
          "until_tick": 4320
        },
        "tags": [
          "resident",
          "student"
        ],
        "transform": {
          "nav_node_id": "nav-room-201",
          "pos_mm": {
            "x": 5909,
            "y": 0,
            "z": 6000
          },
          "room_id": "room-201",
          "rot_mdeg": {
            "x": 0,
            "y": 0,
            "z": 0
          }
        },
        "trauma_flags": []
      },
      {
        "id": "room-101",
        "kind": "room",
        "tags": [
          "floor-1",
          "residential"
        ],
        "transform": {
          "nav_node_id": "nav-room-101",
          "pos_mm": {
            "x": 6000,
            "y": 0,
            "z": 3000
          },
          "room_id": "room-101",
          "rot_mdeg": {
            "x": 0,
            "y": 0,